{
  "version": 1,
  "batch": 8,
  "mode": "offline-video-segmentation-lineage",
  "status": "accepted",
  "context": {
    "minimum_strides_before": 3,
    "minimum_strides_after": 2
  },
  "grouping_keys": [
    "source_video_ref",
    "horse_group_ref",
    "rider_group_ref",
    "arena_group_ref",
    "camera_group_ref",
    "recording_session_ref"
  ],
  "split_ratios": {
    "train": 0.7,
    "validation": 0.1,
    "test": 0.1,
    "golden": 0.1
  },
  "rejection_codes": [
    "invalid-input",
    "capture-not-eligible",
    "metadata-not-preserved",
    "timestamps-not-monotonic",
    "window-out-of-bounds",
    "window-order-invalid",
    "insufficient-context",
    "overlapping-windows",
    "dataset-leakage"
  ],
  "safety": {
    "fail_closed": true,
    "immutable_lineage": true,
    "related_sources_same_split": true,
    "production_data_allowed": false,
    "user_visible_results": false,
    "model_inference": false,
    "database_changes": false
  },
  "fixtures": [
    {
      "fixture_ref": "segment-eligible-primary",
      "expected_decision": "accepted",
      "input": {
        "video_ref": "video-synthetic-primary",
        "capture_decision": "eligible",
        "metadata": {
          "source_timestamps": true,
          "variable_frame_rate": true,
          "original_aspect_ratio": true,
          "source_resolution": true
        },
        "timestamps_ms": [0, 500, 1000, 1500, 2000, 2500, 3000, 3500, 4000, 4500, 5000],
        "groups": {
          "source_video_ref": "source-video-primary",
          "horse_group_ref": "horse-group-alpha",
          "rider_group_ref": "rider-group-alpha",
          "arena_group_ref": "arena-group-indoor",
          "camera_group_ref": "camera-group-side",
          "recording_session_ref": "recording-session-one"
        },
        "candidate_windows": [
          {
            "window_ref": "window-primary-one",
            "fence_ref": "fence-primary-one",
            "start_timestamp_ms": 500,
            "takeoff_timestamp_ms": 2000,
            "landing_timestamp_ms": 3000,
            "end_timestamp_ms": 4500,
            "strides_before": 3,
            "strides_after": 2
          }
        ]
      }
    },
    {
      "fixture_ref": "segment-eligible-related",
      "expected_decision": "accepted",
      "input": {
        "video_ref": "video-synthetic-related",
        "capture_decision": "shadow-only",
        "metadata": {
          "source_timestamps": true,
          "variable_frame_rate": true,
          "original_aspect_ratio": true,
          "source_resolution": true
        },
        "timestamps_ms": [0, 600, 1200, 1800, 2400, 3000, 3600, 4200, 4800, 5400],
        "groups": {
          "source_video_ref": "source-video-related",
          "horse_group_ref": "horse-group-alpha",
          "rider_group_ref": "rider-group-beta",
          "arena_group_ref": "arena-group-outdoor",
          "camera_group_ref": "camera-group-tripod",
          "recording_session_ref": "recording-session-two"
        },
        "candidate_windows": [
          {
            "window_ref": "window-related-one",
            "fence_ref": "fence-related-one",
            "start_timestamp_ms": 600,
            "takeoff_timestamp_ms": 2400,
            "landing_timestamp_ms": 3000,
            "end_timestamp_ms": 4800,
            "strides_before": 4,
            "strides_after": 3
          }
        ]
      }
    },
    {
      "fixture_ref": "segment-rejected-context",
      "expected_decision": "rejected",
      "input": {
        "video_ref": "video-synthetic-rejected",
        "capture_decision": "eligible",
        "metadata": {
          "source_timestamps": true,
          "variable_frame_rate": true,
          "original_aspect_ratio": true,
          "source_resolution": true
        },
        "timestamps_ms": [0, 500, 1000, 1500, 2000, 2500, 3000],
        "groups": {
          "source_video_ref": "source-video-rejected",
          "horse_group_ref": "horse-group-gamma",
          "rider_group_ref": "rider-group-gamma",
          "arena_group_ref": "arena-group-indoor",
          "camera_group_ref": "camera-group-side",
          "recording_session_ref": "recording-session-three"
        },
        "candidate_windows": [
          {
            "window_ref": "window-rejected-one",
            "fence_ref": "fence-rejected-one",
            "start_timestamp_ms": 0,
            "takeoff_timestamp_ms": 1000,
            "landing_timestamp_ms": 2000,
            "end_timestamp_ms": 3000,
            "strides_before": 2,
            "strides_after": 1
          }
        ]
      }
    }
  ],
  "evidence_ref": "docs/BATCH_8_VIDEO_SEGMENTATION_LINEAGE.md"
}
